<?xml version="1.0"?>
<!DOCTYPE Report[
<!ELEMENT Report (General ,(Doc|BPT)) >
<!ATTLIST Report ver CDATA #REQUIRED tmZone CDATA #REQUIRED>

<!ELEMENT General ( DocLocation ) >
<!ATTLIST General productName CDATA #REQUIRED productVer CDATA #REQUIRED os CDATA #REQUIRED host CDATA #REQUIRED qcserver CDATA #IMPLIED qcproject CDATA #IMPLIED SolManSolutionId CDATA #IMPLIED SolManProjectId CDATA #IMPLIED SolManTestPlanId CDATA #IMPLIED SolManTestPackageId CDATA #IMPLIED SolManUserInfoData CDATA #IMPLIED  >

<!ELEMENT BPT (DName,Res,DVer?,TSet?,TInst?,NodeArgs,AdditionalInfo*,Doc*) >
<!ATTLIST BPT rID ID #REQUIRED >

<!ELEMENT Doc (DName,ConfName?,Res,DVer?,TSet?,TInst?,RunType?,DT?,AdditionalInfo*,Step*,DIter*,Step*,Action*,Doc*,Summary?,TestMaintenanceSummary*,NodeArgs?) >
<!ATTLIST Doc rID ID #REQUIRED type (Test|BC|BPTWrapperTest|Flow|Group|Action) "Test" productName CDATA #REQUIRED BCIter CDATA #IMPLIED >

<!ELEMENT RunType ( #PCDATA )>
<!ATTLIST RunType fmStep (False|True) "False" batch (False|True) "False" upDesc (False|True) "False" upChk (False|True) "False" upAS (False|True) "False">

<!ELEMENT DName ( #PCDATA ) >

<!ELEMENT ConfName ( #PCDATA ) >

<!ELEMENT Res ( #PCDATA ) >

<!ELEMENT AdditionalInfo (AdditionalDataName,AdditionalDataValue ) >

<!ELEMENT AdditionalDataName ( #PCDATA ) >

<!ELEMENT AdditionalDataValue ( #PCDATA ) >

<!ELEMENT DVer ( #PCDATA ) >

<!ELEMENT TSet ( #PCDATA ) >

<!ELEMENT TInst ( #PCDATA ) >

<!ELEMENT DIter (Step*,Action+,Summary?,NodeArgs)>
<!ATTLIST DIter rID ID #REQUIRED iterID CDATA #REQUIRED>

<!ELEMENT DocLocation ( #PCDATA )>

<!ELEMENT Action (AName,AIter*,(Step|HtmlStep|Action)*, Summary,ActionMaintenanceSummary*, NodeArgs ) >
<!ATTLIST Action rID ID #REQUIRED>

<!ELEMENT AIter ((Step|HtmlStep|Action)*,DataMapping?, Summary?,NodeArgs) >
<!ATTLIST AIter rID ID #REQUIRED iterID CDATA #REQUIRED isCountable (False|True) "False" >

<!ELEMENT AName ( #PCDATA ) >

<!ELEMENT TestMaintenanceSummary (ActionMaintenanceSummary*) >
<!ATTLIST TestMaintenanceSummary ObjectsAdded CDATA #REQUIRED ObjectsUpdated CDATA #REQUIRED StepsUpdated CDATA #REQUIRED StepsComments CDATA #REQUIRED><!ELEMENT ActionMaintenanceSummary (ObjectChange* ) >
<!ATTLIST ActionMaintenanceSummary Action CDATA #REQUIRED Objects CDATA #REQUIRED Updated CDATA #REQUIRED LinesTotal CDATA #REQUIRED Added CDATA #REQUIRED LinesUpdated CDATA #REQUIRED>

<!ELEMENT ObjectChange  (Hierarchy, PropertyChangeList* ) >
<!ATTLIST ObjectChange Operation CDATA #IMPLIED OriginalRepository CDATA #IMPLIED>

<!ELEMENT PropertyChangeList (PropertyDef*) >

<!ELEMENT PropertyDef (OriginalValue, NewValue) >
<!ATTLIST PropertyDef PropName CDATA #REQUIRED OriginRegularExpression (True|False) "False" NewRegularExpression (True|False) "False" AddedProperty (True|False) "False" >

<!ELEMENT OriginalValue ( #PCDATA )>

<!ELEMENT NewValue ( #PCDATA )>

<!ELEMENT Hierarchy  (ObjectName, Hierarchy*) >
<!ATTLIST Hierarchy MicClass CDATA #REQUIRED>

<!ELEMENT ObjectName  ( #PCDATA ) >

<!ELEMENT Step (Obj,Details,Time,TimeTick* ,(Step|HtmlStep|Doc)*, DataMapping?, NodeArgs) >
<!ATTLIST Step rID ID #REQUIRED retval CDATA #IMPLIED>

<!ELEMENT HtmlStep (HTML,TimeTick*,(Step|HtmlStep|Doc)*,NodeArgs) >
<!ATTLIST HtmlStep rID ID #REQUIRED >

<!ELEMENT Obj ( #PCDATA ) >
<!ATTLIST Obj plainTxt (False|True) "True">

<!ELEMENT Details ( #PCDATA ) >
<!ATTLIST Details plainTxt (False|True) "True">

<!ELEMENT Time ( #PCDATA ) >

<!ELEMENT HTML ( #PCDATA ) >

<!ELEMENT Disp ( #PCDATA ) >

<!ELEMENT TimeTick ( #PCDATA ) >

<!ELEMENT DataMapping ( DataMappedItem* )>
<!ELEMENT DataMappedItem EMPTY >
<!ATTLIST DataMappedItem dsName CDATA #REQUIRED >
<!ATTLIST DataMappedItem rowId CDATA #REQUIRED >

<!ELEMENT NodeArgs (Disp,TopPane?,BtmPane?,ExtendedInfo? )>
<!ATTLIST NodeArgs eType CDATA #REQUIRED icon CDATA #REQUIRED nRep CDATA #REQUIRED UserNote CDATA #IMPLIED filter (False|True) "True">
<!ATTLIST NodeArgs status (Passed|Failed|Done|Warning|Information) "Done">
<!ATTLIST NodeArgs iconSel CDATA #IMPLIED nType CDATA #IMPLIED MovieMarker CDATA "">
<!ATTLIST NodeArgs Source CDATA #IMPLIED SourceLine CDATA #IMPLIED StepFlowItemKey CDATA #IMPLIED >

<!ELEMENT TopPane (Path)>

<!ELEMENT BtmPane ( (Path|WR)?,ASHilite?)>
<!ATTLIST BtmPane vType CDATA "HTML">

<!ELEMENT Path ( #PCDATA ) >

<!ELEMENT ASHilite ( #PCDATA ) >

<!ELEMENT WR ( #PCDATA ) >

<!ELEMENT ExtendedInfo ( StepData ) >

<!ATTLIST ExtendedInfo StepType CDATA #REQUIRED>
<!ELEMENT DT (NodeArgs) >
<!ATTLIST DT rID ID #REQUIRED>

<!ELEMENT Summary (Param*)>
<!ATTLIST Summary sTime CDATA #IMPLIED eTime CDATA #IMPLIED passed CDATA #IMPLIED failed CDATA #IMPLIED warnings CDATA #IMPLIED retval CDATA #IMPLIED stopped (False|True) "False" >

<!ELEMENT Param (ParamName,ParamVal)+ >
<!ATTLIST Param paramInOut (In|Out) "In">

<!ELEMENT ParamName ( #PCDATA ) >

<!ELEMENT ParamVal ( #PCDATA ) >

]>
<Report ver="2.0" tmZone="India Standard Time">
<General productName="OpenText Functional Testing" productVer="24.4" os="" host="LENOVO-L14-GEN-"><DocLocation><![CDATA[D:\UFT Project\API\Tests\FlightReservation]]></DocLocation></General>
<Doc rID="T1" productName="HP Service Test" updated="true">
<DName><![CDATA[FlightReservation]]></DName>
<Res><![CDATA[Result3]]></Res>
<Step rID="T2">
<Obj plainTxt="False"><![CDATA[Start]]></Obj>
<Details plainTxt="False"><![CDATA[]]></Details>
<Time><![CDATA[06-01-2025 - 16:51:12]]></Time>
<TimeTick>1736162472</TimeTick>
<NodeArgs eType="Replay" icon="10001" nRep="5" StepFlowItemKey="StartActivity1">
<Disp><![CDATA[Start]]></Disp>
<BtmPane vType="HTML">
<Path><![CDATA[Data\Step0.xml]]></Path>
</BtmPane>
</NodeArgs>
</Step>
<Step rID="T3">
<Obj plainTxt="False"><![CDATA[Test Flow]]></Obj>
<Details plainTxt="False"><![CDATA[]]></Details>
<Time><![CDATA[06-01-2025 - 16:51:12]]></Time>
<TimeTick>1736162472</TimeTick>
<Action rID="T4">
<AName><![CDATA[]]></AName>
<AIter rID="T5" iterID="1" isCountable="True">
<Step rID="T6">
<Obj plainTxt="False"><![CDATA[GetFlights]]></Obj>
<Details plainTxt="False"><![CDATA[]]></Details>
<Time><![CDATA[06-01-2025 - 16:51:12]]></Time>
<TimeTick>1736162472</TimeTick>
<Step rID="T7">
<Obj plainTxt="False"><![CDATA[Checkpoints]]></Obj>
<Details plainTxt="False"><![CDATA[]]></Details>
<Time><![CDATA[06-01-2025 - 16:51:14]]></Time>
<TimeTick>1736162474</TimeTick>
<NodeArgs eType="Replay" icon="2" nRep="10" status="Passed" StepFlowItemKey="StServiceCallActivity4">
<Disp><![CDATA[Checkpoints]]></Disp>
<BtmPane vType="HTML">
<Path><![CDATA[Data\Step1.xml]]></Path>
</BtmPane>
</NodeArgs>
</Step>
<NodeArgs eType="Replay" icon="10003" nRep="9" status="Passed" StepFlowItemKey="StServiceCallActivity4">
<Disp><![CDATA[GetFlights]]></Disp>
<BtmPane vType="HTML">
<Path><![CDATA[Data\Step2.xml]]></Path>
</BtmPane>
</NodeArgs>
</Step>
<Step rID="T8">
<Obj plainTxt="False"><![CDATA[Loop6]]></Obj>
<Details plainTxt="False"><![CDATA[]]></Details>
<Time><![CDATA[06-01-2025 - 16:51:12]]></Time>
<TimeTick>1736162472</TimeTick>
<Step rID="T9">
<Obj plainTxt="False"><![CDATA[Iteration 1]]></Obj>
<Details plainTxt="False"><![CDATA[]]></Details>
<Time><![CDATA[06-01-2025 - 16:51:12]]></Time>
<TimeTick>1736162472</TimeTick>
<Step rID="T10">
<Obj plainTxt="False"><![CDATA[CreateFlightOrder]]></Obj>
<Details plainTxt="False"><![CDATA[CreateFlightOrder ended unsuccessfully]]></Details>
<Time><![CDATA[06-01-2025 - 16:51:12]]></Time>
<TimeTick>1736162472</TimeTick>
<NodeArgs eType="Replay" icon="10003" nRep="13" status="Failed" StepFlowItemKey="StServiceCallActivity5">
<Disp><![CDATA[CreateFlightOrder]]></Disp>
<BtmPane vType="HTML">
<Path><![CDATA[Data\Step3.xml]]></Path>
</BtmPane>
</NodeArgs>
</Step>
<NodeArgs eType="Replay" icon="4" nRep="12" status="Failed" StepFlowItemKey="Loop6">
<Disp><![CDATA[Iteration 1]]></Disp>
<BtmPane vType="HTML">
<Path><![CDATA[Data\Step4.xml]]></Path>
</BtmPane>
</NodeArgs>
</Step>
<Step rID="T11">
<Obj plainTxt="False"><![CDATA[Iteration 2]]></Obj>
<Details plainTxt="False"><![CDATA[]]></Details>
<Time><![CDATA[06-01-2025 - 16:51:12]]></Time>
<TimeTick>1736162472</TimeTick>
<Step rID="T12">
<Obj plainTxt="False"><![CDATA[CreateFlightOrder]]></Obj>
<Details plainTxt="False"><![CDATA[CreateFlightOrder ended unsuccessfully]]></Details>
<Time><![CDATA[06-01-2025 - 16:51:12]]></Time>
<TimeTick>1736162472</TimeTick>
<NodeArgs eType="Replay" icon="10003" nRep="15" status="Failed" StepFlowItemKey="StServiceCallActivity5">
<Disp><![CDATA[CreateFlightOrder]]></Disp>
<BtmPane vType="HTML">
<Path><![CDATA[Data\Step5.xml]]></Path>
</BtmPane>
</NodeArgs>
</Step>
<NodeArgs eType="Replay" icon="4" nRep="14" status="Failed" StepFlowItemKey="Loop6">
<Disp><![CDATA[Iteration 2]]></Disp>
<BtmPane vType="HTML">
<Path><![CDATA[Data\Step6.xml]]></Path>
</BtmPane>
</NodeArgs>
</Step>
<Step rID="T13">
<Obj plainTxt="False"><![CDATA[Iteration 3]]></Obj>
<Details plainTxt="False"><![CDATA[]]></Details>
<Time><![CDATA[06-01-2025 - 16:51:12]]></Time>
<TimeTick>1736162472</TimeTick>
<Step rID="T14">
<Obj plainTxt="False"><![CDATA[CreateFlightOrder]]></Obj>
<Details plainTxt="False"><![CDATA[CreateFlightOrder ended unsuccessfully]]></Details>
<Time><![CDATA[06-01-2025 - 16:51:12]]></Time>
<TimeTick>1736162472</TimeTick>
<NodeArgs eType="Replay" icon="10003" nRep="17" status="Failed" StepFlowItemKey="StServiceCallActivity5">
<Disp><![CDATA[CreateFlightOrder]]></Disp>
<BtmPane vType="HTML">
<Path><![CDATA[Data\Step7.xml]]></Path>
</BtmPane>
</NodeArgs>
</Step>
<NodeArgs eType="Replay" icon="4" nRep="16" status="Failed" StepFlowItemKey="Loop6">
<Disp><![CDATA[Iteration 3]]></Disp>
<BtmPane vType="HTML">
<Path><![CDATA[Data\Step8.xml]]></Path>
</BtmPane>
</NodeArgs>
</Step>
<Step rID="T15">
<Obj plainTxt="False"><![CDATA[Iteration 4]]></Obj>
<Details plainTxt="False"><![CDATA[]]></Details>
<Time><![CDATA[06-01-2025 - 16:51:12]]></Time>
<TimeTick>1736162472</TimeTick>
<Step rID="T16">
<Obj plainTxt="False"><![CDATA[CreateFlightOrder]]></Obj>
<Details plainTxt="False"><![CDATA[CreateFlightOrder ended unsuccessfully]]></Details>
<Time><![CDATA[06-01-2025 - 16:51:12]]></Time>
<TimeTick>1736162472</TimeTick>
<NodeArgs eType="Replay" icon="10003" nRep="19" status="Failed" StepFlowItemKey="StServiceCallActivity5">
<Disp><![CDATA[CreateFlightOrder]]></Disp>
<BtmPane vType="HTML">
<Path><![CDATA[Data\Step9.xml]]></Path>
</BtmPane>
</NodeArgs>
</Step>
<NodeArgs eType="Replay" icon="4" nRep="18" status="Failed" StepFlowItemKey="Loop6">
<Disp><![CDATA[Iteration 4]]></Disp>
<BtmPane vType="HTML">
<Path><![CDATA[Data\Step10.xml]]></Path>
</BtmPane>
</NodeArgs>
</Step>
<Step rID="T17">
<Obj plainTxt="False"><![CDATA[Iteration 5]]></Obj>
<Details plainTxt="False"><![CDATA[]]></Details>
<Time><![CDATA[06-01-2025 - 16:51:12]]></Time>
<TimeTick>1736162472</TimeTick>
<Step rID="T18">
<Obj plainTxt="False"><![CDATA[CreateFlightOrder]]></Obj>
<Details plainTxt="False"><![CDATA[CreateFlightOrder ended unsuccessfully]]></Details>
<Time><![CDATA[06-01-2025 - 16:51:12]]></Time>
<TimeTick>1736162472</TimeTick>
<NodeArgs eType="Replay" icon="10003" nRep="21" status="Failed" StepFlowItemKey="StServiceCallActivity5">
<Disp><![CDATA[CreateFlightOrder]]></Disp>
<BtmPane vType="HTML">
<Path><![CDATA[Data\Step11.xml]]></Path>
</BtmPane>
</NodeArgs>
</Step>
<NodeArgs eType="Replay" icon="4" nRep="20" status="Failed" StepFlowItemKey="Loop6">
<Disp><![CDATA[Iteration 5]]></Disp>
<BtmPane vType="HTML">
<Path><![CDATA[Data\Step12.xml]]></Path>
</BtmPane>
</NodeArgs>
</Step>
<Step rID="T19">
<Obj plainTxt="False"><![CDATA[Iteration 6]]></Obj>
<Details plainTxt="False"><![CDATA[]]></Details>
<Time><![CDATA[06-01-2025 - 16:51:12]]></Time>
<TimeTick>1736162472</TimeTick>
<Step rID="T20">
<Obj plainTxt="False"><![CDATA[CreateFlightOrder]]></Obj>
<Details plainTxt="False"><![CDATA[CreateFlightOrder ended unsuccessfully]]></Details>
<Time><![CDATA[06-01-2025 - 16:51:12]]></Time>
<TimeTick>1736162472</TimeTick>
<NodeArgs eType="Replay" icon="10003" nRep="23" status="Failed" StepFlowItemKey="StServiceCallActivity5">
<Disp><![CDATA[CreateFlightOrder]]></Disp>
<BtmPane vType="HTML">
<Path><![CDATA[Data\Step13.xml]]></Path>
</BtmPane>
</NodeArgs>
</Step>
<NodeArgs eType="Replay" icon="4" nRep="22" status="Failed" StepFlowItemKey="Loop6">
<Disp><![CDATA[Iteration 6]]></Disp>
<BtmPane vType="HTML">
<Path><![CDATA[Data\Step14.xml]]></Path>
</BtmPane>
</NodeArgs>
</Step>
<Step rID="T21">
<Obj plainTxt="False"><![CDATA[Iteration 7]]></Obj>
<Details plainTxt="False"><![CDATA[]]></Details>
<Time><![CDATA[06-01-2025 - 16:51:12]]></Time>
<TimeTick>1736162472</TimeTick>
<Step rID="T22">
<Obj plainTxt="False"><![CDATA[CreateFlightOrder]]></Obj>
<Details plainTxt="False"><![CDATA[CreateFlightOrder ended unsuccessfully]]></Details>
<Time><![CDATA[06-01-2025 - 16:51:12]]></Time>
<TimeTick>1736162472</TimeTick>
<NodeArgs eType="Replay" icon="10003" nRep="25" status="Failed" StepFlowItemKey="StServiceCallActivity5">
<Disp><![CDATA[CreateFlightOrder]]></Disp>
<BtmPane vType="HTML">
<Path><![CDATA[Data\Step15.xml]]></Path>
</BtmPane>
</NodeArgs>
</Step>
<NodeArgs eType="Replay" icon="4" nRep="24" status="Failed" StepFlowItemKey="Loop6">
<Disp><![CDATA[Iteration 7]]></Disp>
<BtmPane vType="HTML">
<Path><![CDATA[Data\Step16.xml]]></Path>
</BtmPane>
</NodeArgs>
</Step>
<Step rID="T23">
<Obj plainTxt="False"><![CDATA[Iteration 8]]></Obj>
<Details plainTxt="False"><![CDATA[]]></Details>
<Time><![CDATA[06-01-2025 - 16:51:12]]></Time>
<TimeTick>1736162472</TimeTick>
<Step rID="T24">
<Obj plainTxt="False"><![CDATA[CreateFlightOrder]]></Obj>
<Details plainTxt="False"><![CDATA[CreateFlightOrder ended unsuccessfully]]></Details>
<Time><![CDATA[06-01-2025 - 16:51:12]]></Time>
<TimeTick>1736162472</TimeTick>
<NodeArgs eType="Replay" icon="10003" nRep="27" status="Failed" StepFlowItemKey="StServiceCallActivity5">
<Disp><![CDATA[CreateFlightOrder]]></Disp>
<BtmPane vType="HTML">
<Path><![CDATA[Data\Step17.xml]]></Path>
</BtmPane>
</NodeArgs>
</Step>
<NodeArgs eType="Replay" icon="4" nRep="26" status="Failed" StepFlowItemKey="Loop6">
<Disp><![CDATA[Iteration 8]]></Disp>
<BtmPane vType="HTML">
<Path><![CDATA[Data\Step18.xml]]></Path>
</BtmPane>
</NodeArgs>
</Step>
<Step rID="T25">
<Obj plainTxt="False"><![CDATA[Iteration 9]]></Obj>
<Details plainTxt="False"><![CDATA[]]></Details>
<Time><![CDATA[06-01-2025 - 16:51:12]]></Time>
<TimeTick>1736162472</TimeTick>
<Step rID="T26">
<Obj plainTxt="False"><![CDATA[CreateFlightOrder]]></Obj>
<Details plainTxt="False"><![CDATA[CreateFlightOrder ended unsuccessfully]]></Details>
<Time><![CDATA[06-01-2025 - 16:51:12]]></Time>
<TimeTick>1736162472</TimeTick>
<NodeArgs eType="Replay" icon="10003" nRep="29" status="Failed" StepFlowItemKey="StServiceCallActivity5">
<Disp><![CDATA[CreateFlightOrder]]></Disp>
<BtmPane vType="HTML">
<Path><![CDATA[Data\Step19.xml]]></Path>
</BtmPane>
</NodeArgs>
</Step>
<NodeArgs eType="Replay" icon="4" nRep="28" status="Failed" StepFlowItemKey="Loop6">
<Disp><![CDATA[Iteration 9]]></Disp>
<BtmPane vType="HTML">
<Path><![CDATA[Data\Step20.xml]]></Path>
</BtmPane>
</NodeArgs>
</Step>
<Step rID="T27">
<Obj plainTxt="False"><![CDATA[Iteration 10]]></Obj>
<Details plainTxt="False"><![CDATA[]]></Details>
<Time><![CDATA[06-01-2025 - 16:51:12]]></Time>
<TimeTick>1736162472</TimeTick>
<Step rID="T28">
<Obj plainTxt="False"><![CDATA[CreateFlightOrder]]></Obj>
<Details plainTxt="False"><![CDATA[CreateFlightOrder ended unsuccessfully]]></Details>
<Time><![CDATA[06-01-2025 - 16:51:12]]></Time>
<TimeTick>1736162472</TimeTick>
<NodeArgs eType="Replay" icon="10003" nRep="31" status="Failed" StepFlowItemKey="StServiceCallActivity5">
<Disp><![CDATA[CreateFlightOrder]]></Disp>
<BtmPane vType="HTML">
<Path><![CDATA[Data\Step21.xml]]></Path>
</BtmPane>
</NodeArgs>
</Step>
<NodeArgs eType="Replay" icon="4" nRep="30" status="Failed" StepFlowItemKey="Loop6">
<Disp><![CDATA[Iteration 10]]></Disp>
<BtmPane vType="HTML">
<Path><![CDATA[Data\Step22.xml]]></Path>
</BtmPane>
</NodeArgs>
</Step>
<Step rID="T29">
<Obj plainTxt="False"><![CDATA[Iteration 11]]></Obj>
<Details plainTxt="False"><![CDATA[]]></Details>
<Time><![CDATA[06-01-2025 - 16:51:12]]></Time>
<TimeTick>1736162472</TimeTick>
<Step rID="T30">
<Obj plainTxt="False"><![CDATA[CreateFlightOrder]]></Obj>
<Details plainTxt="False"><![CDATA[CreateFlightOrder ended unsuccessfully]]></Details>
<Time><![CDATA[06-01-2025 - 16:51:12]]></Time>
<TimeTick>1736162472</TimeTick>
<NodeArgs eType="Replay" icon="10003" nRep="33" status="Failed" StepFlowItemKey="StServiceCallActivity5">
<Disp><![CDATA[CreateFlightOrder]]></Disp>
<BtmPane vType="HTML">
<Path><![CDATA[Data\Step23.xml]]></Path>
</BtmPane>
</NodeArgs>
</Step>
<NodeArgs eType="Replay" icon="4" nRep="32" status="Failed" StepFlowItemKey="Loop6">
<Disp><![CDATA[Iteration 11]]></Disp>
<BtmPane vType="HTML">
<Path><![CDATA[Data\Step24.xml]]></Path>
</BtmPane>
</NodeArgs>
</Step>
<Step rID="T31">
<Obj plainTxt="False"><![CDATA[Iteration 12]]></Obj>
<Details plainTxt="False"><![CDATA[]]></Details>
<Time><![CDATA[06-01-2025 - 16:51:13]]></Time>
<TimeTick>1736162473</TimeTick>
<Step rID="T32">
<Obj plainTxt="False"><![CDATA[CreateFlightOrder]]></Obj>
<Details plainTxt="False"><![CDATA[CreateFlightOrder ended unsuccessfully]]></Details>
<Time><![CDATA[06-01-2025 - 16:51:13]]></Time>
<TimeTick>1736162473</TimeTick>
<NodeArgs eType="Replay" icon="10003" nRep="35" status="Failed" StepFlowItemKey="StServiceCallActivity5">
<Disp><![CDATA[CreateFlightOrder]]></Disp>
<BtmPane vType="HTML">
<Path><![CDATA[Data\Step25.xml]]></Path>
</BtmPane>
</NodeArgs>
</Step>
<NodeArgs eType="Replay" icon="4" nRep="34" status="Failed" StepFlowItemKey="Loop6">
<Disp><![CDATA[Iteration 12]]></Disp>
<BtmPane vType="HTML">
<Path><![CDATA[Data\Step26.xml]]></Path>
</BtmPane>
</NodeArgs>
</Step>
<Step rID="T33">
<Obj plainTxt="False"><![CDATA[Iteration 13]]></Obj>
<Details plainTxt="False"><![CDATA[]]></Details>
<Time><![CDATA[06-01-2025 - 16:51:13]]></Time>
<TimeTick>1736162473</TimeTick>
<Step rID="T34">
<Obj plainTxt="False"><![CDATA[CreateFlightOrder]]></Obj>
<Details plainTxt="False"><![CDATA[CreateFlightOrder ended unsuccessfully]]></Details>
<Time><![CDATA[06-01-2025 - 16:51:13]]></Time>
<TimeTick>1736162473</TimeTick>
<NodeArgs eType="Replay" icon="10003" nRep="37" status="Failed" StepFlowItemKey="StServiceCallActivity5">
<Disp><![CDATA[CreateFlightOrder]]></Disp>
<BtmPane vType="HTML">
<Path><![CDATA[Data\Step27.xml]]></Path>
</BtmPane>
</NodeArgs>
</Step>
<NodeArgs eType="Replay" icon="4" nRep="36" status="Failed" StepFlowItemKey="Loop6">
<Disp><![CDATA[Iteration 13]]></Disp>
<BtmPane vType="HTML">
<Path><![CDATA[Data\Step28.xml]]></Path>
</BtmPane>
</NodeArgs>
</Step>
<Step rID="T35">
<Obj plainTxt="False"><![CDATA[Iteration 14]]></Obj>
<Details plainTxt="False"><![CDATA[]]></Details>
<Time><![CDATA[06-01-2025 - 16:51:13]]></Time>
<TimeTick>1736162473</TimeTick>
<Step rID="T36">
<Obj plainTxt="False"><![CDATA[CreateFlightOrder]]></Obj>
<Details plainTxt="False"><![CDATA[CreateFlightOrder ended unsuccessfully]]></Details>
<Time><![CDATA[06-01-2025 - 16:51:13]]></Time>
<TimeTick>1736162473</TimeTick>
<NodeArgs eType="Replay" icon="10003" nRep="39" status="Failed" StepFlowItemKey="StServiceCallActivity5">
<Disp><![CDATA[CreateFlightOrder]]></Disp>
<BtmPane vType="HTML">
<Path><![CDATA[Data\Step29.xml]]></Path>
</BtmPane>
</NodeArgs>
</Step>
<NodeArgs eType="Replay" icon="4" nRep="38" status="Failed" StepFlowItemKey="Loop6">
<Disp><![CDATA[Iteration 14]]></Disp>
<BtmPane vType="HTML">
<Path><![CDATA[Data\Step30.xml]]></Path>
</BtmPane>
</NodeArgs>
</Step>
<Step rID="T37">
<Obj plainTxt="False"><![CDATA[Iteration 15]]></Obj>
<Details plainTxt="False"><![CDATA[]]></Details>
<Time><![CDATA[06-01-2025 - 16:51:13]]></Time>
<TimeTick>1736162473</TimeTick>
<Step rID="T38">
<Obj plainTxt="False"><![CDATA[CreateFlightOrder]]></Obj>
<Details plainTxt="False"><![CDATA[CreateFlightOrder ended unsuccessfully]]></Details>
<Time><![CDATA[06-01-2025 - 16:51:13]]></Time>
<TimeTick>1736162473</TimeTick>
<NodeArgs eType="Replay" icon="10003" nRep="41" status="Failed" StepFlowItemKey="StServiceCallActivity5">
<Disp><![CDATA[CreateFlightOrder]]></Disp>
<BtmPane vType="HTML">
<Path><![CDATA[Data\Step31.xml]]></Path>
</BtmPane>
</NodeArgs>
</Step>
<NodeArgs eType="Replay" icon="4" nRep="40" status="Failed" StepFlowItemKey="Loop6">
<Disp><![CDATA[Iteration 15]]></Disp>
<BtmPane vType="HTML">
<Path><![CDATA[Data\Step32.xml]]></Path>
</BtmPane>
</NodeArgs>
</Step>
<Step rID="T39">
<Obj plainTxt="False"><![CDATA[Iteration 16]]></Obj>
<Details plainTxt="False"><![CDATA[]]></Details>
<Time><![CDATA[06-01-2025 - 16:51:13]]></Time>
<TimeTick>1736162473</TimeTick>
<Step rID="T40">
<Obj plainTxt="False"><![CDATA[CreateFlightOrder]]></Obj>
<Details plainTxt="False"><![CDATA[CreateFlightOrder ended unsuccessfully]]></Details>
<Time><![CDATA[06-01-2025 - 16:51:13]]></Time>
<TimeTick>1736162473</TimeTick>
<NodeArgs eType="Replay" icon="10003" nRep="43" status="Failed" StepFlowItemKey="StServiceCallActivity5">
<Disp><![CDATA[CreateFlightOrder]]></Disp>
<BtmPane vType="HTML">
<Path><![CDATA[Data\Step33.xml]]></Path>
</BtmPane>
</NodeArgs>
</Step>
<NodeArgs eType="Replay" icon="4" nRep="42" status="Failed" StepFlowItemKey="Loop6">
<Disp><![CDATA[Iteration 16]]></Disp>
<BtmPane vType="HTML">
<Path><![CDATA[Data\Step34.xml]]></Path>
</BtmPane>
</NodeArgs>
</Step>
<Step rID="T41">
<Obj plainTxt="False"><![CDATA[Iteration 17]]></Obj>
<Details plainTxt="False"><![CDATA[]]></Details>
<Time><![CDATA[06-01-2025 - 16:51:13]]></Time>
<TimeTick>1736162473</TimeTick>
<Step rID="T42">
<Obj plainTxt="False"><![CDATA[CreateFlightOrder]]></Obj>
<Details plainTxt="False"><![CDATA[CreateFlightOrder ended unsuccessfully]]></Details>
<Time><![CDATA[06-01-2025 - 16:51:13]]></Time>
<TimeTick>1736162473</TimeTick>
<NodeArgs eType="Replay" icon="10003" nRep="45" status="Failed" StepFlowItemKey="StServiceCallActivity5">
<Disp><![CDATA[CreateFlightOrder]]></Disp>
<BtmPane vType="HTML">
<Path><![CDATA[Data\Step35.xml]]></Path>
</BtmPane>
</NodeArgs>
</Step>
<NodeArgs eType="Replay" icon="4" nRep="44" status="Failed" StepFlowItemKey="Loop6">
<Disp><![CDATA[Iteration 17]]></Disp>
<BtmPane vType="HTML">
<Path><![CDATA[Data\Step36.xml]]></Path>
</BtmPane>
</NodeArgs>
</Step>
<Step rID="T43">
<Obj plainTxt="False"><![CDATA[Iteration 18]]></Obj>
<Details plainTxt="False"><![CDATA[]]></Details>
<Time><![CDATA[06-01-2025 - 16:51:13]]></Time>
<TimeTick>1736162473</TimeTick>
<Step rID="T44">
<Obj plainTxt="False"><![CDATA[CreateFlightOrder]]></Obj>
<Details plainTxt="False"><![CDATA[CreateFlightOrder ended unsuccessfully]]></Details>
<Time><![CDATA[06-01-2025 - 16:51:13]]></Time>
<TimeTick>1736162473</TimeTick>
<NodeArgs eType="Replay" icon="10003" nRep="47" status="Failed" StepFlowItemKey="StServiceCallActivity5">
<Disp><![CDATA[CreateFlightOrder]]></Disp>
<BtmPane vType="HTML">
<Path><![CDATA[Data\Step37.xml]]></Path>
</BtmPane>
</NodeArgs>
</Step>
<NodeArgs eType="Replay" icon="4" nRep="46" status="Failed" StepFlowItemKey="Loop6">
<Disp><![CDATA[Iteration 18]]></Disp>
<BtmPane vType="HTML">
<Path><![CDATA[Data\Step38.xml]]></Path>
</BtmPane>
</NodeArgs>
</Step>
<Step rID="T45">
<Obj plainTxt="False"><![CDATA[Iteration 19]]></Obj>
<Details plainTxt="False"><![CDATA[]]></Details>
<Time><![CDATA[06-01-2025 - 16:51:13]]></Time>
<TimeTick>1736162473</TimeTick>
<Step rID="T46">
<Obj plainTxt="False"><![CDATA[CreateFlightOrder]]></Obj>
<Details plainTxt="False"><![CDATA[CreateFlightOrder ended unsuccessfully]]></Details>
<Time><![CDATA[06-01-2025 - 16:51:13]]></Time>
<TimeTick>1736162473</TimeTick>
<NodeArgs eType="Replay" icon="10003" nRep="49" status="Failed" StepFlowItemKey="StServiceCallActivity5">
<Disp><![CDATA[CreateFlightOrder]]></Disp>
<BtmPane vType="HTML">
<Path><![CDATA[Data\Step39.xml]]></Path>
</BtmPane>
</NodeArgs>
</Step>
<NodeArgs eType="Replay" icon="4" nRep="48" status="Failed" StepFlowItemKey="Loop6">
<Disp><![CDATA[Iteration 19]]></Disp>
<BtmPane vType="HTML">
<Path><![CDATA[Data\Step40.xml]]></Path>
</BtmPane>
</NodeArgs>
</Step>
<Step rID="T47">
<Obj plainTxt="False"><![CDATA[Iteration 20]]></Obj>
<Details plainTxt="False"><![CDATA[]]></Details>
<Time><![CDATA[06-01-2025 - 16:51:13]]></Time>
<TimeTick>1736162473</TimeTick>
<Step rID="T48">
<Obj plainTxt="False"><![CDATA[CreateFlightOrder]]></Obj>
<Details plainTxt="False"><![CDATA[CreateFlightOrder ended unsuccessfully]]></Details>
<Time><![CDATA[06-01-2025 - 16:51:13]]></Time>
<TimeTick>1736162473</TimeTick>
<NodeArgs eType="Replay" icon="10003" nRep="51" status="Failed" StepFlowItemKey="StServiceCallActivity5">
<Disp><![CDATA[CreateFlightOrder]]></Disp>
<BtmPane vType="HTML">
<Path><![CDATA[Data\Step41.xml]]></Path>
</BtmPane>
</NodeArgs>
</Step>
<NodeArgs eType="Replay" icon="4" nRep="50" status="Failed" StepFlowItemKey="Loop6">
<Disp><![CDATA[Iteration 20]]></Disp>
<BtmPane vType="HTML">
<Path><![CDATA[Data\Step42.xml]]></Path>
</BtmPane>
</NodeArgs>
</Step>
<Step rID="T49">
<Obj plainTxt="False"><![CDATA[Iteration 21]]></Obj>
<Details plainTxt="False"><![CDATA[]]></Details>
<Time><![CDATA[06-01-2025 - 16:51:13]]></Time>
<TimeTick>1736162473</TimeTick>
<Step rID="T50">
<Obj plainTxt="False"><![CDATA[CreateFlightOrder]]></Obj>
<Details plainTxt="False"><![CDATA[CreateFlightOrder ended unsuccessfully]]></Details>
<Time><![CDATA[06-01-2025 - 16:51:13]]></Time>
<TimeTick>1736162473</TimeTick>
<NodeArgs eType="Replay" icon="10003" nRep="53" status="Failed" StepFlowItemKey="StServiceCallActivity5">
<Disp><![CDATA[CreateFlightOrder]]></Disp>
<BtmPane vType="HTML">
<Path><![CDATA[Data\Step43.xml]]></Path>
</BtmPane>
</NodeArgs>
</Step>
<NodeArgs eType="Replay" icon="4" nRep="52" status="Failed" StepFlowItemKey="Loop6">
<Disp><![CDATA[Iteration 21]]></Disp>
<BtmPane vType="HTML">
<Path><![CDATA[Data\Step44.xml]]></Path>
</BtmPane>
</NodeArgs>
</Step>
<Step rID="T51">
<Obj plainTxt="False"><![CDATA[Iteration 22]]></Obj>
<Details plainTxt="False"><![CDATA[]]></Details>
<Time><![CDATA[06-01-2025 - 16:51:13]]></Time>
<TimeTick>1736162473</TimeTick>
<Step rID="T52">
<Obj plainTxt="False"><![CDATA[CreateFlightOrder]]></Obj>
<Details plainTxt="False"><![CDATA[CreateFlightOrder ended unsuccessfully]]></Details>
<Time><![CDATA[06-01-2025 - 16:51:13]]></Time>
<TimeTick>1736162473</TimeTick>
<NodeArgs eType="Replay" icon="10003" nRep="55" status="Failed" StepFlowItemKey="StServiceCallActivity5">
<Disp><![CDATA[CreateFlightOrder]]></Disp>
<BtmPane vType="HTML">
<Path><![CDATA[Data\Step45.xml]]></Path>
</BtmPane>
</NodeArgs>
</Step>
<NodeArgs eType="Replay" icon="4" nRep="54" status="Failed" StepFlowItemKey="Loop6">
<Disp><![CDATA[Iteration 22]]></Disp>
<BtmPane vType="HTML">
<Path><![CDATA[Data\Step46.xml]]></Path>
</BtmPane>
</NodeArgs>
</Step>
<Step rID="T53">
<Obj plainTxt="False"><![CDATA[Iteration 23]]></Obj>
<Details plainTxt="False"><![CDATA[]]></Details>
<Time><![CDATA[06-01-2025 - 16:51:13]]></Time>
<TimeTick>1736162473</TimeTick>
<Step rID="T54">
<Obj plainTxt="False"><![CDATA[CreateFlightOrder]]></Obj>
<Details plainTxt="False"><![CDATA[CreateFlightOrder ended unsuccessfully]]></Details>
<Time><![CDATA[06-01-2025 - 16:51:13]]></Time>
<TimeTick>1736162473</TimeTick>
<NodeArgs eType="Replay" icon="10003" nRep="57" status="Failed" StepFlowItemKey="StServiceCallActivity5">
<Disp><![CDATA[CreateFlightOrder]]></Disp>
<BtmPane vType="HTML">
<Path><![CDATA[Data\Step47.xml]]></Path>
</BtmPane>
</NodeArgs>
</Step>
<NodeArgs eType="Replay" icon="4" nRep="56" status="Failed" StepFlowItemKey="Loop6">
<Disp><![CDATA[Iteration 23]]></Disp>
<BtmPane vType="HTML">
<Path><![CDATA[Data\Step48.xml]]></Path>
</BtmPane>
</NodeArgs>
</Step>
<Step rID="T55">
<Obj plainTxt="False"><![CDATA[Iteration 24]]></Obj>
<Details plainTxt="False"><![CDATA[]]></Details>
<Time><![CDATA[06-01-2025 - 16:51:13]]></Time>
<TimeTick>1736162473</TimeTick>
<Step rID="T56">
<Obj plainTxt="False"><![CDATA[CreateFlightOrder]]></Obj>
<Details plainTxt="False"><![CDATA[CreateFlightOrder ended unsuccessfully]]></Details>
<Time><![CDATA[06-01-2025 - 16:51:13]]></Time>
<TimeTick>1736162473</TimeTick>
<NodeArgs eType="Replay" icon="10003" nRep="59" status="Failed" StepFlowItemKey="StServiceCallActivity5">
<Disp><![CDATA[CreateFlightOrder]]></Disp>
<BtmPane vType="HTML">
<Path><![CDATA[Data\Step49.xml]]></Path>
</BtmPane>
</NodeArgs>
</Step>
<NodeArgs eType="Replay" icon="4" nRep="58" status="Failed" StepFlowItemKey="Loop6">
<Disp><![CDATA[Iteration 24]]></Disp>
<BtmPane vType="HTML">
<Path><![CDATA[Data\Step50.xml]]></Path>
</BtmPane>
</NodeArgs>
</Step>
<Step rID="T57">
<Obj plainTxt="False"><![CDATA[Iteration 25]]></Obj>
<Details plainTxt="False"><![CDATA[]]></Details>
<Time><![CDATA[06-01-2025 - 16:51:13]]></Time>
<TimeTick>1736162473</TimeTick>
<Step rID="T58">
<Obj plainTxt="False"><![CDATA[CreateFlightOrder]]></Obj>
<Details plainTxt="False"><![CDATA[CreateFlightOrder ended unsuccessfully]]></Details>
<Time><![CDATA[06-01-2025 - 16:51:13]]></Time>
<TimeTick>1736162473</TimeTick>
<NodeArgs eType="Replay" icon="10003" nRep="61" status="Failed" StepFlowItemKey="StServiceCallActivity5">
<Disp><![CDATA[CreateFlightOrder]]></Disp>
<BtmPane vType="HTML">
<Path><![CDATA[Data\Step51.xml]]></Path>
</BtmPane>
</NodeArgs>
</Step>
<NodeArgs eType="Replay" icon="4" nRep="60" status="Failed" StepFlowItemKey="Loop6">
<Disp><![CDATA[Iteration 25]]></Disp>
<BtmPane vType="HTML">
<Path><![CDATA[Data\Step52.xml]]></Path>
</BtmPane>
</NodeArgs>
</Step>
<Step rID="T59">
<Obj plainTxt="False"><![CDATA[Iteration 26]]></Obj>
<Details plainTxt="False"><![CDATA[]]></Details>
<Time><![CDATA[06-01-2025 - 16:51:13]]></Time>
<TimeTick>1736162473</TimeTick>
<Step rID="T60">
<Obj plainTxt="False"><![CDATA[CreateFlightOrder]]></Obj>
<Details plainTxt="False"><![CDATA[CreateFlightOrder ended unsuccessfully]]></Details>
<Time><![CDATA[06-01-2025 - 16:51:13]]></Time>
<TimeTick>1736162473</TimeTick>